"EUPH code",Name,English,Definition,Parent
2957,"royal jelly harvesting equipment","royal jelly harvesting equipment","Any equipment used specifically for the harvest of royal jelly.",2956
2958,"propolis harvesting equipment","propolis harvesting equipment","Any equipment used specifically for the harvest of propolis.",2956
2959,"pollen trap","pollen trap","A device mounted at the hive entrance, outside or inside the hive, which forces worker bees to pass through narrow holes, causing the loss of pollen pellets stored on the hind legs of worker bees foraging for pollen. The lost pollen pellets are stored in a tray and periodically collected by the beekeeper.",2954
2960,"propolis trap","propolis trap","An perforated object such as a sheet with a small mesh size made of food grade plastic, that is placed on top of the upper bar of the uppermost hive body, causing draft. The bees would close the holes of the object with a mixture of wax and propolis.",2958
2961,Apidae,Apidae,"The taxonomic family Apidae.",7744
2962,Hymenoptera,hymenoptera,"The taxonomic [order](https://app.pollinatorhub.eu/vocabulary/classes/7452) Hymenoptera",2963
2963,Insecta,insect,"The taxonomic [class](https://app.pollinatorhub.eu/vocabulary/classes/7456) Insecta",2964
2964,Arthropoda,Arthropoda,"The taxonomic [phylum](https://app.pollinatorhub.eu/vocabulary/classes/7455) Arthropoda",2965
2965,Animalia,Animalia,"The taxonomic [Kingdom](https://app.pollinatorhub.eu/vocabulary/classes/7454) Animalia",3306
2966,"feral colony","feral colony","A feral honey bee colony",1133
2967,"Apis mellifera carnica","Carniolan Honey Bee;Apis mellifera carnica","The [subspecies](https://app.pollinatorhub.eu/vocabulary/classes/7424) *[Apis mellifera](https://app.pollinatorhub.eu/vocabulary/classes/19) carnica* Pollmann occurring south of the Alps, and west into the Balkans.",7379
2968,"Apis mellifera mellifera","Apis mellifera mellifera","The [subspecies](https://app.pollinatorhub.eu/vocabulary/classes/7424) *[Apis mellifera](https://app.pollinatorhub.eu/vocabulary/classes/19) mellifera* Linnaeus, occurring throughout Central Europe morth of the Alps, as far as south as southern [France](https://app.pollinatorhub.eu/vocabulary/classes/225) in the west, southern [Sweden](https://app.pollinatorhub.eu/vocabulary/classes/376) in the north, central Russia in the east, and on the British Isles. In the [Ukraine](https://app.pollinatorhub.eu/vocabulary/classes/394) there is a transition over the steppe region to *A. mellifera sossimai*.",7379
2969,"animal breeding","animal breeding","[Animal] breeding is the deliberate selection and directed mating of animals in a breeding population with the intention of producing offspring that, on average, are closer in their characteristics to a defined breeding objective than the parent generation. 

> (Original source: Züchten ist die gezielte Selektion und gerichtete Paarung von Tieren einer Zcuhtpopulation mit der Absicht Nachkommen zu erzeugen, die im Durchschnitt in ihren Eigenschaften einem definierten Zuchtziel näher sind als die Elterngeneration.)",3266;7866
2970,"animal breed","animal breed","In general, a breed is a group of domesticated animals of the same species that are similar in morphological, physiological and ethological characteristics, *i.e.* in appearance or exterior (lat. *exterior*; on the outside), performance and behaviour, and have a common breeding history.

> [Original source:] Im Allgemeinen versteht man unter einer Rasse eine Gruppe von domestizierten Tieren der gleichen Art, die sich in morphologischen, physiologischen und ethologischen Amerkmalenm d.h. im Aussehen bzw. Exterieur (lat. *exterior*; auf der Außenseite), in der Leistung und im Verhalten ähnlich sind und eine gemeinsame Zuchtgeschichte haben.",2969
2971,Carnica,carniolan,"The Carnica [breed](https://app.pollinatorhub.eu/vocabulary/classes/7868) originating from animals of the subspecies *[Apis mellifera carnica](https://app.pollinatorhub.eu/vocabulary/classes/2967)*.",7868
2972,Mellifera,Mellifera,"The Mellifera [breed](https://app.pollinatorhub.eu/vocabulary/classes/7868) originating from animals of the subspecies *[Apis mellifera mellifera](https://app.pollinatorhub.eu/vocabulary/classes/2968)*.",7868
2973,"breeding population","breeding population","The term race is [...] not clearly defined in the genetic sense. [...] Genetically, a population (<i>lat. populus: people, crowd</i>) is a group of animals of the same species that forms a mating community and represents a common gene pool. In animal breeding, the term population [...] is usually equated with a breed or only a part of a breed, the so-called breeding population.

> [Original source:] Der Begriff Rasse ist [...] im genetischen Sinn nicht eindeutig definiert. [...] Genetisch gesehen ist eine Population  (lat. *populus*: Volk, Menge) eine Gruppe von Tieren der gleichen Art, die eine Paarungsgemeinschaft bildet und einen gemeinsamen Genpool darstellt. Der Begriff Population [...] wird in der Tierzucht üblicherweise mit einer Rasse oder nur einem Teil einer Rasse, der sogenannten Zuchtpopulation, gleichgesetzt.",2970
2974,"plant protection product","plant protection product",">[...] Products, in the form in which they are supplied to the user, consisting of or containing active substances, safeners or synergists, and intended for one of the following uses: (a) protecting plants or plant products against all harmful organisms or preventing the action of such organisms, unless the main purpose of these products is considered to be for reasons of hygiene rather than for the protection of plants or plant products; (b) influencing the life processes of plants, such as substances influencing their growth, other than as a nutrient; (c) preserving plant products, in so far as such substances or products are not subject to special Community provisions on preservatives; (d) destroying undesired plants or parts of plants, except algae unless the products are applied on soil or water to protect plants; (e) checking or preventing undesired growth of plants, except algae unless the products are applied on soil or water to protect plants. These products are referred to as ‘plant protection products’.",1087
2975,Plantae,Plants,"The taxonomic [Kingdom](https://app.pollinatorhub.eu/vocabulary/classes/7454) Plantae",3306
2976,spring,spring,"<q>period between the vernal equinox and the summer solstice</q>",7346
2977,summer,summer,"<q>period between the summer solstice and the autumnal equinox</q>",7346
2978,fall,autumn,"<q>period between the autumnal equinox and the winter solstice</q>",7346
2979,winter,winter,"<q>period between the winter solstice and the vernal equinox</q>",7346
2980,biology,biology,"> The scientific study of living organisms.",3359
2981,ecology,ecology,"> The branch of biology concerned with the relations between organisms and their environment.",2980
2982,botany,botany,"> Botany; the branch of biology that studies plants.",2980
2983,zoology,zoology,"> The branch of biology dealing with the study of animals.",2980
2984,mutualism,mutualism,"The ecological interaction between two or more species in which each species has a benefit.",2981
2985,pollination,pollination,"> Pollination is the transfer of pollen from an anther of a plant to the stigma of a plant, later enabling fertilisation and the production of seeds, most often by an animal or by wind. [...] Pollinating agents can be animals such as insects, birds, and bats; water; wind; and even plants themselves, when self-pollination occurs within a closed flower. Pollination often occurs within a species. When pollination occurs between species, it can produce hybrid offspring in nature and in plant breeding work.",2981
2986,Buckfast,Buckfast,"The Buckfast breed.",7868
2987,beekeeper,beekeeper;apiarist;beeman,"A person managing honey bee colonies.",1128
2988,great,great,"> of much more than ordinary size, extent, volume, etc.",127
2989,little,little,"<q>small in size; not big, large, or great</q>",127
2990,modest,modest,"<q>moderate or reasonable, mot extreme</q>",127
2991,essential,essential,"<q>of or constituting the intrinsic, fundamental nature of something</q>",127
2992,"no increase","no increase","The opposite of increase",127
2993,increase,increase,"<q>to become greater in size, amount, degree, etc.; grow</q>",127
2994,unknown,unknown,"<q>not known; specif., a) not in the knowledge, understanding, or acquaintance of someone; unfamiliar (to) b) not discovered, identified, determined, explored, etc.</q>",127
2995,"[PPM_TOT] Pesticides placed on the market, total","Pesticides placed on the market, total","Major group <q>Pesticides placed on the market, total</q> (code PPM_TOT) of pesticides according to the Harmonised Classification of Subastances, as contained in Annex III of Commission Regulation (EU) 2017/269 of 16 February 2017.",7448
2996,"[PPM_PU] Pesticides placed on the market for professional users","Pesticides placed on the market for professional users","Product category <q>Pesticides placed on the market for professional users</q> (code PPM_PU) of pesticides according to the Harmonised Classification of Subastances, as contained in Annex III of Commission Regulation (EU) 2017/269 of 16 February 2017.",2995
2997,"[PPM_AGRI] - of which intended for use in agriculture","of which intended for use in agriculture","Product category <q>- Of which intended for use in agriculture</q> (code PPM_AGRI) of pesticides according to the Harmonised Classification of Subastances, as contained in Annex III of Commission Regulation (EU) 2017/269 of 16 February 2017.",2995
2998,"[PPM_FORE] - of which intended for use in forestry","of which intended for use in forestry","Product category <q>- Of which intended for use in forestry</q> (code PPM_FORE) of pesticides according to the Harmonised Classification of Subastances, as contained in Annex III of Commission Regulation (EU) 2017/269 of 16 February 2017.",2995
2999,"[PPM_AMU] - of which intended for other professional uses","of which intended for other professional uses","Product category <q>- Of which intended for other professional uses</q> (code PPM_AMU) of pesticides according to the Harmonised Classification of Subastances, as contained in Annex III of Commission Regulation (EU) 2017/269 of 16 February 2017.",2995
3000,"[PPM_STOR] - of which solely used in storage","of which solely used in storage","Product category <q>- Of which solely used in storage</q> (code PPM_STOR) of pesticides according to the Harmonised Classification of Subastances, as contained in Annex III of Commission Regulation (EU) 2017/269 of 16 February 2017.",2995
3001,"Pesticides placed on the market in accordance with Articles 22 and 24 of Regulation (EC) No 1107/2009 of the European Parliament and of the Council","Pesticides placed on the market in accordance with Articles 22 and 24 of Regulation (EC) No 1107/2009 of the European Parliament and of the Council","Major group <q>Pesticides placed on the market in accordance with Articles 22 and 24 of Regulation (EC) No 1107/2009 of the European Parliament and of the Council</q> of pesticides according to the Harmonised Classification of Subastances, as contained in Annex III of Commission Regulation (EU) 2017/269 of 16 February 2017.",2995
3002,"[GRP1] Group 1 - Low-risk active substances in accordance with Article 22 of Regulation (EC) No 1107/2009","Group 1 - Low-risk active substances in accordance with Article 22 of Regulation (EC) No 1107/2009","Product category <q>Group 1 - Low-risk active substances in accordance with Article 22 of Regulation (EC) No 1107/2009</q> (code GRP1) of pesticides according to the Harmonised Classification of Subastances, as contained in Annex III of Commission Regulation (EU) 2017/269 of 16 February 2017.",3001
3003,"[GRP3] Group 3 - Candidates for substitution in accordance with Article 24 of Regulation (EC) No 1107/2009","Group 3 - Candidates for substitution in accordance with Article 24 of Regulation (EC) No 1107/2009","Product category <q>Group 3 - Candidates for substitution in accordance with Article 24 of Regulation (EC) No 1107/2009</q> (code GRP3) of pesticides according to the Harmonised Classification of Subastances, as contained in Annex III of Commission Regulation (EU) 2017/269 of 16 February 2017.",3001
3004,"Pesticides placed on the market, groups and categories defined in Annex IV to Directive 2009/128/EC","Pesticides placed on the market, groups and categories defined in Annex IV to Directive 2009/128/EC","Major group <q>Pesticides placed on the market, groups and categories defined in Annex IV to Directive 2009/128/EC</q> of pesticides according to the Harmonised Classification of Subastances, as contained in Annex III of Commission Regulation (EU) 2017/269 of 16 February 2017.",2995
3005,"[GRP2] Group 2 - Active substances approved or deemed to be approved under Regulation (EC) No 1107/2009, and not falling under other categories, which are listed in Parts A and B of the Annex to Implementing Regulation (EU) No 540/2011","Group 2 - Active substances approved or deemed to be approved under Regulation (EC) No 1107/2009, and not falling under other categories, which are listed in Parts A and B of the Annex to Implementing Regulation (EU) No 540/2011","Product category <q>Group 2 - Active substances approved or deemed to be approved under Regulation (EC) No 1107/2009, and not falling under other categories, which are listed in Parts A and B of the Annex to Implementing Regulation (EU) No 540/2011 (10) </q> (code GRP2) of pesticides according to the Harmonised Classification of Subastances, as contained in Annex III of Commission Regulation (EU) 2017/269 of 16 February 2017.",3004
3006,"[GRP4] Group 4 - Active substances which are not approved under Regulation (EC) No 1107/2009, and which are therefore not listed in the Annex to Implementing Regulation (EU) No 540/2011","Group 4 - Active substances which are not approved under Regulation (EC) No 1107/2009, and which are therefore not listed in the Annex to Implementing Regulation (EU) No 540/2011","Product category <q>Group 4 - Active substances which are not approved under Regulation (EC) No 1107/2009, and which are therefore not listed in the Annex to Implementing Regulation (EU) No 540/2011</q> (code GRP4) of pesticides according to the Harmonised Classification of Subastances, as contained in Annex III of Commission Regulation (EU) 2017/269 of 16 February 2017.",3004
3007,"[CAT_A_C] Category A and C: Non-chemical active substances","Category A and C: Non-chemical active substance","Product category <q>Category A and C: Non-chemical active substances</q> (code CAT_A_C) of pesticides according to the Harmonised Classification of Subastances, as contained in Annex III of Commission Regulation (EU) 2017/269 of 16 February 2017.",3004
3008,"[CAT_B_D-F] Category B, D, E, F: Chemical active substances","Category B, D, E, F: Chemical active substances","Product category <q>Category B, D, E, F: Chemical active substances</q> (code CAT_B_D-F) of pesticides according to the Harmonised Classification of Subastances, as contained in Annex III of Commission Regulation (EU) 2017/269 of 16 February 2017.",3004
3009,"[PES_F] Fungicides and bactericides","fungicides and bactericides","Major group <q>Fungicides and bactericides</q> (code PES_F) of pesticides according to the Harmonised Classification of Subastances, as contained in Annex III of Commission Regulation (EU) 2017/269 of 16 February 2017.",7448
3010,"[F01] Inorganic fungicides","inorganic fungicides","Product category <q>Inorganic fungicides</q> (code F01) of pesticides according to the Harmonised Classification of Subastances, as contained in Annex III of Commission Regulation (EU) 2017/269 of 16 February 2017.",3009
3011,"[F01_01] COPPER COMPOUNDS","copper compounds","Chemical class <q>COPPER COMPOUNDS</q> (code F01_01) of pesticides according to the Harmonised Classification of Subastances, as contained in Annex III of Commission Regulation (EU) 2017/269 of 16 February 2017.",3010
3012,"[F01_02] INORGANIC SULFUR","inorganic sulfur","Chemical class <q>INORGANIC SULPHUR</q> (code F01_02) of pesticides according to the Harmonised Classification of Subastances, as contained in Annex III of Commission Regulation (EU) 2017/269 of 16 February 2017.",3010
3013,"[F01_99] OTHER INORGANIC FUNGICIDES","other inorganic fungicides","Chemical class <q>OTHER INORGANIC FUNGICIDES</q> (code F01_99) of pesticides according to the Harmonised Classification of Subastances, as contained in Annex III of Commission Regulation (EU) 2017/269 of 16 February 2017.",3010
3014,"[F02] Fungicides based on carbamates and dithiocarbamates","fungicides based on carbamates and dithiocarbamates","Product category <q>Fungicides based on carbamates and dithiocarbamates</q> (code F02) of pesticides according to the Harmonised Classification of Subastances, as contained in Annex III of Commission Regulation (EU) 2017/269 of 16 February 2017.",3009
3015,"[F02_01] CARBANILATE FUNGICIDES","carbanilate fungicides","Chemical class <q>CARBANILATE FUNGICIDES</q> (code F02_01) of pesticides according to the Harmonised Classification of Subastances, as contained in Annex III of Commission Regulation (EU) 2017/269 of 16 February 2017.",3014
3016,"[F02_02] CARBAMATE FUNGICIDES","carbamate fungicides","Chemical class <q>CARBAMATE FUNGICIDES</q> (code F02_02) of pesticides according to the Harmonised Classification of Subastances, as contained in Annex III of Commission Regulation (EU) 2017/269 of 16 February 2017.",3014
3017,"[F02_03] DITHIOCARBAMATE FUNGICIDES","dithiocarbamate fungicides","Chemical class <q>DITHIOCARBAMATE FUNGICIDES</q> (code F02_03) of pesticides according to the Harmonised Classification of Subastances, as contained in Annex III of Commission Regulation (EU) 2017/269 of 16 February 2017.",3014
3018,"[F02_99] OTHER FUNGICIDES BASED ON CARBAMATES AND DITHIOCARBAMATES","other fungicides based on carbamates and dithiocarbamates","Chemical class <q>OTHER FUNGICIDES BASED ON CARBAMATES AND DITHIOCARBAMATES</q> (code F02_99) of pesticides according to the Harmonised Classification of Subastances, as contained in Annex III of Commission Regulation (EU) 2017/269 of 16 February 2017.",3014
3019,"[F03] Fungicides based on benzimidazoles","fungicides based on benzimidazoles","Product category <q>Fungicides based on benzimidazoles</q> (code F03) of pesticides according to the Harmonised Classification of Subastances, as contained in Annex III of Commission Regulation (EU) 2017/269 of 16 February 2017.",3009
3020,"[F03_01] BENZIMIDAZOLE FUNGICIDES","benzimidazole fungicides","Chemical class <q>BENZIMIDAZOLE FUNGICIDES</q> (code F03_01) of pesticides according to the Harmonised Classification of Subastances, as contained in Annex III of Commission Regulation (EU) 2017/269 of 16 February 2017.",3019
3021,"[F03_99] OTHER FUNGICIDES BASED ON BENZIMIDAZOLES","other fungicides based on benzimidazoles","Chemical class <q>OTHER FUNGICIDES BASED ON BENZIMIDAZOLES</q> (code F03_99) of pesticides according to the Harmonised Classification of Subastances, as contained in Annex III of Commission Regulation (EU) 2017/269 of 16 February 2017.",3019
3022,"[F04] Fungicides based on imidazoles and triazoles","fungicides based on imidazoles and triazoles","Product category <q>Fungicides based on imidazoles and triazoles</q> (code F04) of pesticides according to the Harmonised Classification of Subastances, as contained in Annex III of Commission Regulation (EU) 2017/269 of 16 February 2017.",3009
3023,"[F04_01] CONAZOLE FUNGICIDES","conazole fungicides","Chemical class <q>CONAZOLE FUNGICIDES</q> (code F04_01) of pesticides according to the Harmonised Classification of Subastances, as contained in Annex III of Commission Regulation (EU) 2017/269 of 16 February 2017.",3022
3024,"[F04_02] IMIDAZOLE FUNGICIDES","imidazole fungicides","Chemical class <q>IMIDAZOLE FUNGICIDES</q> (code F04_02) of pesticides according to the Harmonised Classification of Subastances, as contained in Annex III of Commission Regulation (EU) 2017/269 of 16 February 2017.",3022
3025,"[F04_99] OTHER FUNGICIDES BASED ON IMIDAZOLES AND TRIAZOLES","other fungicides based on imidazoles and triazoles","Chemical class <q>OTHER FUNGICIDES BASED ON IMIDAZOLES AND TRIAZOLES</q> (code F04_99) of pesticides according to the Harmonised Classification of Subastances, as contained in Annex III of Commission Regulation (EU) 2017/269 of 16 February 2017.",3022
3026,"[F05] Fungicides based on morpholines","fungicides based on morpholines","Product category <q>Fungicides based on morpholines</q> (code F05) of pesticides according to the Harmonised Classification of Subastances, as contained in Annex III of Commission Regulation (EU) 2017/269 of 16 February 2017.",3009
3027,"[F05_01] MORPHOLINE FUNGICIDES","morpholine fungicides","Chemical class <q>MORPHOLINE FUNGICIDES</q> (code F05_01) of pesticides according to the Harmonised Classification of Subastances, as contained in Annex III of Commission Regulation (EU) 2017/269 of 16 February 2017.",3026
3028,"[F05_99] OTHER FUNGICIDES BASED ON MORPHOLINES","other fungicides based on morpholines","Chemical class <q>OTHER FUNGICIDES BASED ON MORPHOLINES</q> (code F05_99) of pesticides according to the Harmonised Classification of Subastances, as contained in Annex III of Commission Regulation (EU) 2017/269 of 16 February 2017.",3026
3029,"[F06] Fungicides of microbiological or botanical origin","fungicides of microbiological or botanical origin","Product category <q>Fungicides of microbiological or botanical origin</q> (code F06) of pesticides according to the Harmonised Classification of Subastances, as contained in Annex III of Commission Regulation (EU) 2017/269 of 16 February 2017.",3009
3030,"[F06_01] MICROBIOLOGICAL FUNGICIDES","microbiological fungicides","Chemical class <q>MICROBIOLOGICAL FUNGICIDES</q> (code F06_01) of pesticides according to the Harmonised Classification of Subastances, as contained in Annex III of Commission Regulation (EU) 2017/269 of 16 February 2017.",3029
3031,"[F06_02] BOTANICAL FUNGICIDES","botanical fungicides","Chemical class <q>BOTANICAL FUNGICIDES</q> (code F06_02) of pesticides according to the Harmonised Classification of Subastances, as contained in Annex III of Commission Regulation (EU) 2017/269 of 16 February 2017.",3029
3032,"[F06_99] OTHER FUNGICIDES OF MICROBIOLOGICAL OR BOTANICAL ORIGIN","other fungicides of microbiological origin","Chemical class <q>OTHER FUNGICIDES OF MICROBIOLOGICAL OR BOTANICAL ORIGIN</q> (code F06_99) of pesticides according to the Harmonised Classification of Subastances, as contained in Annex III of Commission Regulation (EU) 2017/269 of 16 February 2017.",3029
3033,"[F07] Bactericides",bactericides,"Product category <q>Bactericides</q> (code F07) of pesticides according to the Harmonised Classification of Subastances, as contained in Annex III of Commission Regulation (EU) 2017/269 of 16 February 2017.",3009
3034,"[F07_01] INORGANIC BACTERICIDES","inorganic bactericides","Chemical class <q>INORGANIC BACTERICIDES</q> (code F07_01) of pesticides according to the Harmonised Classification of Subastances, as contained in Annex III of Commission Regulation (EU) 2017/269 of 16 February 2017.",3033
3035,"[F07_99] OTHER BACTERICIDES","other bactericides","Chemical class <q>OTHER BACTERICIDES</q> (code F07_99) of pesticides according to the Harmonised Classification of Subastances, as contained in Annex III of Commission Regulation (EU) 2017/269 of 16 February 2017.",3033
3036,"[F99] Other fungicides and bactericides","other fungicides and bactericides","Product category <q>Other fungicides and bactericides</q> (code F99) of pesticides according to the Harmonised Classification of Subastances, as contained in Annex III of Commission Regulation (EU) 2017/269 of 16 February 2017.",3009
3037,"[F99_01] ALIPHATIC NITROGEN FUNGICIDES","aliphatic nitrogen fungicides","Chemical class <q>ALIPHATIC NITROGEN FUNGICIDES</q> (code F99_01) of pesticides according to the Harmonised Classification of Subastances, as contained in Annex III of Commission Regulation (EU) 2017/269 of 16 February 2017.",3036
3038,"[F99_02] AMIDE FUNGICIDES","amide fungicides","Chemical class <q>AMIDE FUNGICIDES</q> (code F99_02) of pesticides according to the Harmonised Classification of Subastances, as contained in Annex III of Commission Regulation (EU) 2017/269 of 16 February 2017.",3036
3039,"[F99_03] ANILIDE FUNGICIDES","anilide fungicides","Chemical class <q>ANILIDE FUNGICIDES</q> (code F99_03) of pesticides according to the Harmonised Classification of Subastances, as contained in Annex III of Commission Regulation (EU) 2017/269 of 16 February 2017.",3036
3040,"[F99_05] AROMATIC FUNGICIDES","aromatic fungicides","Chemical class <q>AROMATIC FUNGICIDES</q> (code F99_05) of pesticides according to the Harmonised Classification of Subastances, as contained in Annex III of Commission Regulation (EU) 2017/269 of 16 February 2017.",3036
3041,"[F99_06] DICARBOXIMIDE FUNGICIDES","dicarboximide fungicides","Chemical class <q>DICARBOXIMIDE FUNGICIDES</q> (code F99_06) of pesticides according to the Harmonised Classification of Subastances, as contained in Annex III of Commission Regulation (EU) 2017/269 of 16 February 2017.",3036
3042,"[F99_07] DINITROANILINE FUNGICIDES","dinitroaniline fungicides","Chemical class <q>DINITROANILINE FUNGICIDES</q> (code F99_07) of pesticides according to the Harmonised Classification of Subastances, as contained in Annex III of Commission Regulation (EU) 2017/269 of 16 February 2017.",3036
