"EUPH code",Name,English,Definition,Parent
7317,"FAOSTAT Year Description","FAOSTAT Year Description","Description of a period lasting one year for which [FAOSTAT](https://app.pollinatorhub.eu/vocabulary/classes/3265) provides data, summarised in the ""Definitions and standards - Crops and livestock products"" list on the web page ""Crops and livestock products"" of the [FAOSTAT website](https://www.fao.org/faostat/en/#data/QCL).",3265
7320,"honey yield","honey yield","The amount of honey that was harvested.",23
7321,date,date,"> [time](https://app.pollinatorhub.eu/vocabulary/classes/437) [...] on the [calendar](https://app.pollinatorhub.eu/vocabulary/classes/7394) [...] [time scale](https://app.pollinatorhub.eu/vocabulary/classes/7390) [...] Common forms of date include [calendar date](https://app.pollinatorhub.eu/vocabulary/classes/7408) [...], [ordinal date](https://app.pollinatorhub.eu/vocabulary/classes/7410) [...] or [week date](https://app.pollinatorhub.eu/vocabulary/classes/7412) [...].",437
7322,string,String,"In computer programming, a string is traditionally a sequence of characters, either as a literal constant or as some kind of variable. The latter may allow its elements to be mutated and the length changed, or it may be fixed (after creation). A string is generally considered as a data type and is often implemented as an array data structure of bytes (or words) that stores a sequence of elements, typically characters, using some character encoding. String may also denote more general arrays or other sequence (or list) data types and structures.",7340
7324,integer,integer,"An integer is the number zero (0), a positive natural number (1, 2, 3, . . .), or the negation of a positive natural number (−1, −2, −3, . . .).",548
7325,"decimal numeral","decimal number","A decimal numeral (also often just decimal or, less correctly, decimal number), refers generally to the notation of a number in the decimal numeral system. Decimals may sometimes be identified by a decimal separator (usually ""."" or "","" as in 25.9703 or 3,1415).[3] Decimal may also refer specifically to the digits after the decimal separator, such as in ""3.14 is the approximation of π to two decimals"". Zero-digits after a decimal separator serve the purpose of signifying the precision of a value.",548
7326,"mated queen","mated queen","A member of the [queen](https://app.pollinatorhub.eu/vocabulary/classes/28) [caste](https://app.pollinatorhub.eu/vocabulary/classes/1132), which has been mated by male.",28
7327,"unmated queen","unmated queen","A member of the [queen](https://app.pollinatorhub.eu/vocabulary/classes/28) [caste](https://app.pollinatorhub.eu/vocabulary/classes/1132), which has not (yet) been mated.",28
7328,"time of day","time of day","> [time](https://app.pollinatorhub.eu/vocabulary/classes/437) [...] occurring within a [calendar day](https://app.pollinatorhub.eu/vocabulary/classes/3349) [...] Generally, time of day relates to the [duration](https://app.pollinatorhub.eu/vocabulary/classes/7392) [...] elapsed after the beginning of the day. However, this correlation breaks when changes occur in the [time scale](https://app.pollinatorhub.eu/vocabulary/classes/7390) [...] that applies to the time of day, such as [time shifts](https://app.pollinatorhub.eu/vocabulary/classes/7399) [...] and [leap seconds](https://app.pollinatorhub.eu/vocabulary/classes/7398) [...]. This definition corresponds closely with the definition of “clock time” given in IEC 60050-113:2011, 113-01-18, except that the concepts of duration and time scale are not used in this definition.",3349
7329,"calendar date and local time of day","date and time","[calendar date](https://app.pollinatorhub.eu/vocabulary/classes/7408) and [local time of day](https://app.pollinatorhub.eu/vocabulary/classes/7417) in ISO 8601 format YYYY-MM-DD hh:mm:ss, for example 2022-09-27 18:00:00.000",7408
7330,"personal data","personal data","Personal data is any information relating to an identified or identifiable natural person (‘data subject’); an identifiable natural person is one who can be identified, directly or indirectly, in particular by reference to an identifier such as a name, an identification number, location data, an online identifier or to one or more factors specific to the physical, physiological, genetic, mental, economic, cultural or social identity of that natural person;",7339
7331,"email address","email address","An email address identifies an email box to which messages are delivered.",7330
7332,"home address","home address","The [address](https://app.pollinatorhub.eu/vocabulary/classes/7342) of a person.",7342
7333," identity document number","ID number","The number on a document used for the unique identification of a person's identity.",7330
7334,"internet protocol (IP) address","IP address","An Internet Protocol address (IP address) is a numerical label such as 192.0.2.1 that is assigned to a device connected to a computer network that uses the Internet Protocol for communication.",7330
7335,"telephone number","telephone number","A telephone number is a sequence of digits assigned to a landline telephone subscriber station connected to a telephone line or to a wireless electronic telephony device, such as a radio telephone or a mobile telephone, or to other devices for data transmission via the public switched telephone network (PSTN), or other public and private networks.",7330
7336,"personal name","personal name;prosoponym","A personal name, full name or prosoponym (from Ancient Greek prósōpon – person, and onoma –name)[...] is the set of names by which an individual person or animal is known, and that can be recited as a word-group, with the understanding that, taken together, they all relate to that one individual.",7330
7337,surname,surname,"A surname, family name, or last name is the mostly hereditary portion of one's [personal name](https://app.pollinatorhub.eu/vocabulary/classes/7336) that indicates one's family.[...] It is typically combined with a given name to form the full name of a person, although several given names and surnames are possible in the full name.",7336
7338,"computer science","computer science","> The study of the structure and dynamics of computational systems using mathematical, logical, and empirical tools.",7369
7339,data,data,"[...] data [...] is a collection of discrete or continuous values that convey information, describing the quantity, quality, fact, statistics, other basic units of meaning, or simply sequences of symbols that may be further interpreted formally.",7338
7340,"data type","data type","In computer science and computer programming, a data type (or simply type) is a collection or grouping of data values, usually specified by a set of possible values, a set of allowed operations on these values, and/or a representation of these values as machine types.",7519
7341,"data structure","data structure","In computer science, a data structure is a data organization and storage format that is usually chosen for efficient access to data.[...] More precisely, a data structure is a collection of data values, the relationships among them, and the functions or operations that can be applied to the data,[...] i.e., it is an algebraic structure about data.",7339
7342,address,address,"An address is a collection of information, presented in a mostly fixed format, used to give the location of a building, apartment, or other structure or a plot of land, generally using political boundaries and street names as references, along with other identifiers such as house or apartment numbers and organization name.",7330
7343,"given name","given name","A given name (also known as a forename or first name) is the part of a [personal name](https://app.pollinatorhub.eu/vocabulary/classes/7336) that identifies a person, potentially with a middle name as well, and differentiates that person from the other members of a group (typically a family or clan) who have a common surname. The term given name refers to a name usually bestowed at or close to the time of birth, usually by the parents of the newborn.

",7336
7344,"start date","start date","[Calendar date](https://app.pollinatorhub.eu/vocabulary/classes/7408) in which a [dwc:Event](https://app.pollinatorhub.eu/vocabulary/classes/7474) starts.",7351
7346,season,season,"[...] any of the four arbitrary divisions of the year, characterized chiefly by differences in temperature, precipitation, amount of daylight, and plant growth [...]",571
7347,"quantification cycle (Cq)","quantification cycle","Depending on the real-time instrument, either threshold cycle (Ct), crossing point (Cp) or a take-off point (Top) are used to refer to the same quantification cycle value (Cq): the fractional PCR cycle at which the target is quantified in a given sample. It was proposed to use the term **quantification cycle** (**Cq**) in accordance with the data standard RDML (Real-Time PCR Data Markup Language)",7858
7348,"Varroa infestation rate of adult bees","infestation rate of adult bees","The quantity infestation rate of adult [honey bees](https://app.pollinatorhub.eu/vocabulary/classes/19) (*Apis mellifera*) colonies with [Varroa mites](https://app.pollinatorhub.eu/vocabulary/classes/80) (*Varroa destructor*), measured by dislodging [Varroa mites](https://app.pollinatorhub.eu/vocabulary/classes/80) from adult [honey bees](https://app.pollinatorhub.eu/vocabulary/classes/19), expressed in number of Varroa mites per unit of honey bees.",421;3340
7349,"crown board","crown board","Board made of wood or other material, used as inner cover and positioned on top of a hive between the top supers and the roof (outer cover). It is used to close the hive and help the bees to maintain the hive temperature. Depending on the construction, it may also be used in conjunction with a bee escape to remove bees from supers or containa centre hole to be used with a feeder.",8
7350,"unix time","Unix time","Unix time is a date and time representation widely used in computing. It measures time by the number of non-leap seconds that have elapsed since 00:00:00 UTC on 1 January 1970, the Unix epoch. [...] Unix time is sometimes referred to as Epoch time. This can be misleading since Unix time is not the only time system based on an epoch and the Unix epoch is not the only epoch used by other time systems.",7351
7351,"date and time data types","date and time data types","Date and time [data types](https://app.pollinatorhub.eu/vocabulary/classes/7340) for representing temporal values.",7340
7352,"coordinated Universal Time (UTC) offset","UTC offset","The UTC offset is the difference in hours and minutes between Coordinated Universal Time (UTC) and local solar time, at a particular place. This difference is expressed with respect to UTC and is generally shown in the format ±[hh]:[mm], ±[hh][mm], or ±[hh].",7397
7353,rainfall,rainfall,"> The [amount of precipitatio](https://glossary.ametsoc.org/wiki/Amount_of_precipitation)n of any type (including the liquid equivalent of frozen [hydrometeors](https://glossary.ametsoc.org/wiki/Hydrometeors)); usually taken as that amount measured by means of a [rain gauge](https://glossary.ametsoc.org/wiki/Rain_gauge) (thus a small, varying amount of direct [condensation](https://glossary.ametsoc.org/wiki/Condensation) is included). A more accurate term would be precipitation or [precipitation](https://glossary.ametsoc.org/wiki/Precipitation) amount. However, the broad use of ""rainfall"" is firmly established in meteorology, especially in hydrologic and climatological literature. Its best utilization would confine it to liquid precipitation, and so would provide a distinction between precipitation immediately accessible to soil and streams and that delayed in storage as [snow](https://glossary.ametsoc.org/wiki/Snow) or [ice](https://glossary.ametsoc.org/wiki/Ice) on the earth's surface.
",421;7354
7354,meteorology,meteorology,"> Meteorology is the branch of science that deals with atmospheric phenomena and processes, especially with a view to forecasting the weather.",3359
7355,snow,snow,"> [Precipitation](https://glossary.ametsoc.org/wiki/Precipitation) composed of white or translucent [ice crystals](https://glossary.ametsoc.org/wiki/Ice_crystals), chiefly in complex branch hexagonal form and often agglomerated into [snowflakes](https://glossary.ametsoc.org/wiki/Snowflakes).
> For weather-observing purposes, the [intensity](https://glossary.ametsoc.org/wiki/Intensity) of snow is characterized as 1) light when the [visibility](https://glossary.ametsoc.org/wiki/Visibility) is 1 km (5/8 [statute mile](https://glossary.ametsoc.org/wiki/Statute_mile)) or more; 2) moderate when the visibility is less than 1 km (5/8 statute mile) but not less than 1/2 km (5/16 statute mile); and 3) heavy when the visibility is less than 1/2 km (5/16 statute mile).",7354
7356,"precipitation intensity","precipitation intensity","> The rate of [precipitation](https://glossary.ametsoc.org/wiki/Precipitation), usually expressed in millimeters or inches per hour. ",421;7353
7357,wind,wind,"> Air in motion relative to the surface of the earth. Since vertical components of atmospheric motion are relatively small, especially near the surface of the earth, meteorologists use the term to denote almost exclusively the horizontal component. Vertical winds are usually identified as such. Surface winds are measured by [anemometer](https://glossary.ametsoc.org/wiki/Anemometer) and [wind vane](https://glossary.ametsoc.org/wiki/Wind_vane); [winds aloft](https://glossary.ametsoc.org/wiki/Winds_aloft) by such systems as [pilot balloon](https://glossary.ametsoc.org/wiki/Pilot_balloon), [radiosonde](https://glossary.ametsoc.org/wiki/Radiosonde), or aircraft navigational techniques.
",7354
7358,"wind speed","wind speed","> The rate at which air is moving horizontally past a given point. It may be a 2-minute average speed (reported as wind speed) or an instantaneous speed (reported as a peak wind speed, [wind gust](https://app.pollinatorhub.eu/vocabulary/classes/7360), or squall).",421;7357
7359,"wind direction","wind direction","The true direction from which the wind is blowing at a given location (i.e., wind blowing from the north to the south is a north wind). It is normally measured in tens of degrees from 10 degrees clockwise through 360 degrees. North is 360 degrees. A wind direction of 0 degrees is only used when wind is calm. ",421;7357
7360,"wind gust","wind gust","Rapid fluctuations in the wind speed with a variation of 10 knots or more between peaks and lulls. The speed of the gust will be the maximum instantaneous wind speed.",421;7357
7361,"solar irradiance","solar irradiance","Solar irradiance is the power per unit area (surface power density) received from the Sun in the form of electromagnetic radiation in the wavelength range of the measuring instrument. Solar irradiance is measured in watts per square metre (W/m2) in SI units. ",421;7354
7362,"rate of solar radiation","rate of solar radiation","The langley (Ly) is a unit of heat transmission, especially used to express the rate of solar radiation (or insolation) received by the earth.",421;7361
7363,"colour model","colour model","In color science, a color model is an abstract mathematical model describing the way colors can be represented as tuples of numbers, typically as three or four values or color components.",7338
7364,"RGB colour model","RGB colour model","The RGB color model is an additive color model in which the red, green and blue primary colors of light are added together in various ways to reproduce a broad array of colors. The name of the model comes from the initials of the three additive primary colors, red, green, and blue.",7363
7365,"RGB numeric representation","numeric representation of RGB colour model","A colour in the [RGB colour](https://app.pollinatorhub.eu/vocabulary/classes/7364) model expressed with numbers.",7364
7366,"RGB digital 8-bit per channel  notation","RGB digital 8-bit per channel notation","The numerical representation of an RGB colour code, expressed as RGB triplets with decimal or hexadecimal numbers. The first, second and third triplets indicate how much red, green or blue is contained in the colour. With decimal numbers, the colour code is written between round brackets, the triplets are unsigned integers that are separated by a comma and can have values from 0 to 255. For hexadecimal numbers, the code is written as a single block beginning with #, followed by hexadecimal numbers that can take values from 00 to FF.",7365
7367,Location,location,"A term from the [Darwin Core standard](https://dwc.tdwg.org/list/#dcterms_Location) based on the [DCMI Metadata Terms Vocabulary](https://www.dublincore.org/specifications/dublin-core/dcmi-terms/#Location):

> A spatial region or named place.
",960;7507
7368,user,user,"A user is a person who utilizes a computer or network service. A user often has a user account and is identified to the system by a username (or user name).",7330
7369,engineering,engineering,"> The discipline concerned with the application of scientific knowledge to solve practical issues in commerce or industry.",3359
7370,appliance,appliance,"A device is usually a constructed tool, *i.e.* an object that can extend an individual's ability to modify features of the surrounding environment or help them accomplish a particular task.",7369
7371,mathematics,mathematics,"> The study of numbers, shapes, patterns, and logical reasoning.",3359
7372,statistics,statistics,"> A branch of applied mathematics concerned with the collection and interpretation of quantitative data and the use of probability theory to estimate population parameters.",7371
7373,"sample size","sample size","The number of observations or data points in a sample.",7835
7374,larva,larva,"A larva [...] is a distinct juvenile form many animals undergo before metamorphosis into their next life stage. Animals with indirect development such as insects, some arachnids, amphibians, or cnidarians typically have a larval phase of their life cycle. ",24
7375,other,other,"being the remaining one or ones of two or more",127
7376,"bee-friendliness (BF) index","bee-friendliness index;BF index","Bee-friendliness (BF) index developed by the [B-GOOD project](https://b-good-project.eu), that corresponds to the contribution of each plant species in terms of bee-friendliness within a particular BIOEUNIS habitat. The BF index was calculated as the multiplication of the BF Value by occurrence and by average cover, i.e. BF Index = BF Value x Occurrence x Average cover. The higher the BF index, the greater the contribution of a plant species in terms of bee-friendliness within the habitat.",2981
7377,"BIOEUNIS habitat code","BIOEUNIS habitat code","Terrestrial Level 2 habitat code of the spatially explicit habitat classification and typology system applied by the [B-GOOD Project](https://b-good-project.eu) by merging the European Nature Information System (EUNIS) and the Biogeographical regions in Europe.
",2981
7378,species,species,"A species [...] is a population of organisms in which any two individuals of the appropriate sexes or mating types can produce fertile offspring, typically by sexual reproduction. It is the basic unit of classification and a taxonomic rank of an organism, as well as a unit of biodiversity. Other ways of defining species include their karyotype, DNA sequence, morphology, behaviour, or ecological niche. In addition, paleontologists use the concept of the chronospecies since fossil reproduction cannot be examined.",7453
7379,"subspecies of Apis mellifera","subspecies of Apis mellifera","A [subspicies](https://app.pollinatorhub.eu/vocabulary/classes/7424) of the [species](https://app.pollinatorhub.eu/vocabulary/classes/7378) *[Western honey bee](https://app.pollinatorhub.eu/vocabulary/classes/19)* (*Apis mellifera* L).",19
7380,"EUNIS habitat classification","EUNIS habitat classification","European Nature Information System ([EUNIS](https://eunis.eea.europa.eu/)) habitat classification is a comprehensive pan-European system for habitat identification. The classification is hierarchical and covers all types of habitats from natural to artificial, from terrestrial to freshwater and marine. The habitat types are identified by specific codes, names and descriptions and come with cross-walks to other habitat typologies.",2981;7834
7381,"EUNIS habitat code","EUNIS habitat code","Code issued by the [EUNIS habitat classification](https://app.pollinatorhub.eu/vocabulary/classes/7380).",7380
7382,"EUNIS level 1 habitat code","EUNIS level 1 habitat code","Highest rank of the [EUNIS habitat classification](https://app.pollinatorhub.eu/vocabulary/classes/7380) hierarchy.",7377;7381
7383,"EUNIS level 2 habitat code","EUNIS level 2 habitat code","Second highest rank of the [EUNIS habitat classification](https://app.pollinatorhub.eu/vocabulary/classes/7380) hierarchy.",7382
7384,"EUNIS level 3 habitat code","EUNIS level 3 habitat code","Third highest rank of the [EUNIS habitat classification](https://app.pollinatorhub.eu/vocabulary/classes/7380) hierarchy.",7383
7385,Genus,genus,"A term from the [Darwin Core standard](https://dwc.tdwg.org/list/#dwc_genus):
> The full scientific name of the genus in which the [dwc:Taxon](https://app.pollinatorhub.eu/vocabulary/classes/7451) is classified.",7451;7460
7386,Family,family,"A term from the [Darwin Core standard](https://dwc.tdwg.org/list/#dwc_family):
> The full scientific name of the family in which the [dwc:Taxon](https://app.pollinatorhub.eu/vocabulary/classes/7451) is classified.",7451;7457
7387,"calendar week","calendar week","> [time scale unit](https://app.pollinatorhub.eu/vocabulary/classes/7393) [...] of seven [calendar days](https://app.pollinatorhub.eu/vocabulary/classes/3349) [...] which begins on Monday and ends on Sunday, according to the [week calendar](https://app.pollinatorhub.eu/vocabulary/classes/7396) [...]",7393
7388,"time axis","time axis","> mathematical representation of the succession in time according to the space-time model of instantaneous events along a unique axis
> Note 1 to entry: According to the theory of special relativity, the time axis depends on the choice of a spatial reference frame.
> Note 2 to entry: In IEC 60050-113:2011, 113-01-03, time according to the space-time model is defined to be the one-dimensional subspace of space-time, locally orthogonal to space.
> [SOURCE:IEC 60050-113:2011, 113-01-07, modified — The words “according to the space-time” have been added; the phrase “special theory of relativity” has been changed to “theory of special relativity” for clarity; Note 2 to entry has been added.]",7587
7389,instant,instant,"> point on the [time axis](https://app.pollinatorhub.eu/vocabulary/classes/7388) [...]
> Note 1 to entry: An instantaneous event occurs at a specific instant.
> [SOURCE:IEC 60050-113:2011, 113-01-08]",7388
7390,"time scale","time scale","> system of ordered marks which can be attributed to [instants](https://app.pollinatorhub.eu/vocabulary/classes/7389) [...] on the [time axis](https://app.pollinatorhub.eu/vocabulary/classes/7388) [...], one instant being chosen as the origin
> Note 1 to entry: A time scale may amongst others be chosen as:
> — continuous, e.g. international atomic time (TAI) (see IEC 60050-713:1998, 713-05-18);
> — continuous with discontinuities, e.g. [UTC](https://app.pollinatorhub.eu/vocabulary/classes/7397) [...] due to [leap seconds](https://app.pollinatorhub.eu/vocabulary/classes/7398) [...], [standard time](https://app.pollinatorhub.eu/vocabulary/classes/7400) [...] due to summer time and winter time;
> — successive steps, e.g. [calendars](https://app.pollinatorhub.eu/vocabulary/classes/7394) [...], where the [time axis](https://app.pollinatorhub.eu/vocabulary/classes/7388) [...] is split up into a succession of consecutive [time intervals](https://app.pollinatorhub.eu/vocabulary/classes/7391) [...] and the same mark is attributed to all instants of each time interval;
> — discrete, e.g. in digital techniques.
> [SOURCE:IEC 60050-113:2011, 113-01-11, modified — The words “amongst others” in Note 1 to entry have been added; NOTEs 2 and 3 have been deleted.]",7388
7391,"time interval","time interval","> part of the [time axis](https://app.pollinatorhub.eu/vocabulary/classes/7388) [...] limited by two [instants](https://app.pollinatorhub.eu/vocabulary/classes/7389) [...] and, unless otherwise stated, the limiting instants themselves
> [SOURCE:IEC 60050-113:2011, 113-01-10, modified — The words “and, unless otherwise stated, the limiting instants themselves” have been added; the NOTEs have been deleted.]",7388
