"EUPH code",Name,English,Definition,Parent
1,"Robinia pseudoacacia","false locust","The [taxonomic species](https://www.gbif.org/species/2889373) *Robinia pseudoacacia* L.",51
2,"Castanea sativa","sweet chestnut","The [taxonomic species](https://www.gbif.org/species/2889373) *Castanea sativa* Mill.",51;8001
3,"Brassica napus",rapeseed,"The [taxonomic species](https://app.pollinatorhub.eu/vocabulary/classes/7378) *Brassica napus* L.",51
4,intermediate,intermediate,"<q>being or happening vetween to things, places, stages, etc.; in thee middle</q>",127
5,apiary,"apiary;bee yard","Any [location](https://app.pollinatorhub.eu/vocabulary/classes/7367) where one or more [beehives](https://app.pollinatorhub.eu/vocabulary/classes/8) are kept as a management unit.",126
6,colony,colony,"<q>A group of eusocial bees living together in the same nest.</q>",8;19
7,frame,frame,"<q>An enclosed structure intended to hold drawn comb. Frames are often rectangular structures. They are distinct from top bars which are not enclosed.</q>",8
8,beehive,hive,"> Any container provided by people within which bees can build their nest.",5
9,"hive body","brood chamber","The box of a movable frame hive in which the bees generally raise their brood. Also referred to as 'deep'.",8
10,"honey super",super,"The box of a movable frame hive in which the honey bees generally store honey. Also referred to as 'super' or 'shallow'.",8
11,"queen excluder","queen excluder","A queen excluder is a grid of [metal](https://app.pollinatorhub.eu/vocabulary/classes/1188) wire, or a perforated sheet of [plastic](https://app.pollinatorhub.eu/vocabulary/classes/1179) or of any other [material](https://app.pollinatorhub.eu/vocabulary/classes/1173), that is placed between the box containing the brood nest and the box containing the [honey super](https://app.pollinatorhub.eu/vocabulary/classes/10). It prevents the [queen](https://app.pollinatorhub.eu/vocabulary/classes/28) from entering the [honey super](https://app.pollinatorhub.eu/vocabulary/classes/10).",8
12,foundation,foundation,"Thin rectangular sheets of wax or other material imprinted with a hexagonal cell pattern, which serves as a basis on which honey bees build their comb.",7
13,"frame of drawn comb","frame of drawn comb","[A frame type](https://app.pollinatorhub.eu/vocabulary/classes/3278) containing a sheet of [beeswax](https://app.pollinatorhub.eu/vocabulary/classes/1159) [foundation](https://app.pollinatorhub.eu/vocabulary/classes/12) whose hexagonal [cells](https://app.pollinatorhub.eu/vocabulary/classes/22) have been drawn out using [beeswax](https://app.pollinatorhub.eu/vocabulary/classes/1159) produced by [worker bees](https://app.pollinatorhub.eu/vocabulary/classes/42).",3278
14,"frame of empty drawn comb","empty frame","Empty frame of drawn comb",13
15,"division board","division board","Board made of wood or other, insulating material, fitting in place of a regular frame. It is used to reduce the working space within a hive, help the bees to maintain brood rearing temperature and increase air flow.",8
16,"frame feeder","frame feeder","A feeder fitting in place of one or more regular frames in a beehive, usually used in the brood chamber to feed a honey bee colony.",8
17,"hive body frame","deep frame","A frame used in a hive body of hive types having different frame sizes.",9;3278
18,"honey super frame","medium frame;shallow frame","A frame used in a honey super of hive types having different frame sizes.",10;3278
19,"Apis mellifera","Western honey bee","The taxonomic species <i>Apis mellifera</i> Linnaeus, 1758",128
20,pollen,pollen,"<q>Usually a powdery substance consisting of pollen grains which are male microgametophytes of seed plants, which produce male gametes. Male reproductive cells of flowers collected at anthers and used by bees for rearing their young. It is the protein part of the diet; termed bee bread when processed and stored in cells in teh colony</q>",50
21,comb,comb,"<q>A structure made of hexagonal cells in which honey bees rear young and store food. Typical comb materials include beeswax (e.g. honey bee), plant tissue (e.g. wasps)  and plastic (e.g. beekeeping industry).</q>",6
22,cell,cell,"The hexagonal prismatic structure built by honey bees or other insects in their nests to contain larvae and/or stores of honey and/or pollen. A mass of cells forms a comb.",21
23,honey,honey,"<q>Honey is the natural sweet substance produced by Apis mellifera bees from the nectar of plants or from secretions of living parts of plants or excretions of plant-sucking insects on the living parts of plants, which the bees collect, transform by combining with specific substances of their own, deposit, dehydrate, store and leave in honeycombs to ripen and mature.</q>",1194
24,brood,brood,"An egg, a larva, a pupa or an adult shortly before hatching contained in a cell of a comb.",22
25,"uncapped brood","uncapped brood","Brood (egg or larvae), contained in cells of a comb, which are not capped with a lid of material used to build combs.",24
26,"capped brood","capped brood","Brood (larvae, pupae, adults), contained in cells of a comb, which are capped with a lid of material used to build combs.",24
27,empty,empty,"<q>unoccupied, at leisure, containing nothing, having nothing in it</q>",127
28,queen,queen,"<q>The fully developed, reproductive female in a colony of bees, ants, or termites</q>",6
29,egg,egg,"> The oval round body laid by a female bird, fish, reptile, insect, etc., containing the germ of a new individual along with food for its development, and having an enclosed shell or membrane.",24;7924
30,drone,drone,"<q>A male bee, as a male honeybee, or ant which serves only in reproductive capacity, has no sting, and does not work.</q>",6
31,"drone brood","drone brood","Brood consisting exlusively of eggs, larvae, pupae or non-hatches imagini of male drones.",24
32,"queen cell","queen cell","An egg, a larva, a pupa, or an adult female shortly before hatching contained in a specialised cell on a comb, which has been determined to become a member of the queen caste.",24
33,"uncapped queen cell","uncapped queen cell","An egg, a larva, a pupa, or an adult female shortly before hatching contained in a specialised cell on a comb, which has been determined to become a member of the queen caste and which is not capped with a lid of material used to build combs.",32
34,"capped queen cell","capped queen cell","An egg, a larva, a pupa, or an adult female shortly before hatching contained in a specialised cell on a comb, which has been determined to become a member of the queen caste and which is capped with a lid of material used to build combs.",32
35,"queen cell chewed at the bottom","queen cell chewed at the bottom 	","<q>Queen cell in which a hatched queen has chewed a hole on the side, causing the workers to remove the larva or pupa inside.</q>",32
36,swarm,swarm,"<q>A temporary cluster of adult bees that have left a hive with the queen and full stomachs at a temporary bivouac site seeking to move to a new home.</q>",6
37,"to swarm",swarm,"The act of abandonment by a group of individuals, who togeTher found a new colony.",36
38,queenless,queenless,"<q>The condition of a colony lacking a queen.</q>",6
39,queenright,queenright,"<q>A colony with a healthy, worker egg-laying queen. The opposite of queenless.</q>",6
40,supersedure,supersedure,"<q>The replacement of a weak or old queen in a colony by a daughter queen - a natural occurrence.</q>",6
41,"requeening by beekeeper","requeening by beekeeper","Intentional replacement of a queen by the beekeeper.",6
42,"worker bee","worker bee","<q>A female bee whose reproductive organs are only partially developed; responsible for carrying on all inside-hive duties except egg-laying, amd all outside foraging for food, water, and propolis.</q>",6
43,"drone layer","drone laying queen","<q>A queen which lays only unfertilized, drone eggs, resulting from improperly or non-mated queen or an older queen that has run out of sperm.</q>",28
44,"laying worker","laying worker","A worker bee which lays unfertilised eggs, usually in the absence of a queen. ",42
45,"drone laying colony","drone laying colony","A conoy in which the queen lays only unfertilized, drone eggs.",6
46,"laying worker colony","laying worker colony","A queenless colnoy in which worker bees lay unfertilised eggs. ",6
47,Taraxacum,"dandelion ","The taxonomic genus <i>Taraxacum</i> Weber (<i>Asteraceae</i>)",51
48,"escape board","escape board","A board with a maze placed between the upper deep-hive body and a honey super. It serves to clear the bees from overlaying honey supers.",8
49,forage,forage,"<q>Food for domestic animals</q>",3266
50,"honey bee forage","honey bee forage","Food supply for honey bees, consisting of nectar and other secretions of living parts of plants, excretions of plant-sucking insects of the order Hemiptera on the living parts of plants (honeydew), and pollen.",126;3320
51,"honey bee forage plant","honey bee forage plant","Plants on which honey bees forage.",50
52,"fruit trees","fruit trees","Nectar and pollen forage crops, which in Central Europe bloom in spring and comprise species such as <i>Cydonia oblonga</i>, <i>Malus domestica</i>, <i>Prunus armeniaca</i>, <i>Prunus avium</i>, <i>Prunus cerasus</i>, <i>Prunus domestica</i>, <i>Prunus persica</i>, <i>Pyrus communis</i>.",51;3296
53,Hemiptera,Hemiptera,"The taxonomic [order](https://app.pollinatorhub.eu/vocabulary/classes/7452) Hemiptera",2963
54,"Malus domestica",apple,"The [taxonomic species](https://www.gbif.org/species/2889373) *Malus domestica* Borkh.",52;3312
55,"Pyrus communis",pear,"The [taxonomic species](https://www.gbif.org/species/2889373) *Pyrus communis* L.",52;3312
56,"Prunus avium","sweet cherry","The [taxonomic species](https://www.gbif.org/species/2889373) *Prunus avium (L.)* L.",52;3308
57,"Prunus armeniaca",apricot,"The [taxonomic species](https://www.gbif.org/species/2889373) *Prunus armeniaca* L.",52;3308
58,"Prunus persica",peach,"The [taxonomic species](https://www.gbif.org/species/2889373) *Prunus persica* (L.) Stokes",52;3308
59,"Cydonia oblonga",quince,"The [taxonomic species](https://www.gbif.org/species/2889373) *Cydonia oblonga* Mill.",52;3312
60,"Prunus cerasus","sour cherry;cherry","The [taxonomic species](https://www.gbif.org/species/2889373) *Prunus cerasus* L.",52;3308
61,"Prunus domestica",plum,"The [taxonomic species](https://www.gbif.org/species/2889373) *Prunus domestica* L.",52;3308
62,"Sambucus nigra","Black Elder","The [taxonomic species](https://www.gbif.org/species/2889373) *Sambucus nigra* L.",52
63,"honey flow","honey flow","<q>A time of year, perhaps more than once, when abundant nectar is available for collection and the field bees are sufficiently populous to store and ripen nectar for future use by bees or surplus for human harvest.</q>",50
64,"nucleus colony","nucleus colony","<q>A colony of bees made by colony division; used to make colonies, as support (resource) hives and in queen rearing (maating nuc).</q>",6
65,"nuc box","nucleus box","A container provided by people within which nucleus colonies can build their nest.",64
66,parasite,parasite,"An organism that lives in or on another organism, referred to as host, and that takes its nourishment from that other organism.",97
67,"Achroia grisella","lesser wax moth","The taxonomic species <i>Achroia grisella</i> (Fabricius, 1794) (<i>Rosaceae</i>), a parasite on <i>Apis mellifera</i> Linnaeus, 1758",76
68,"bald brood","bald brood","<q>Single cells or patches of honey bee brood with uncapped cells that expose the heads of live, apparently normal pupae. This condition usually occurs when lesser wax moth larvae perforate the outer cell walls and the wax cappings; worker bees then chew away the remainder of the cell caps, thereby exposing the developing pupae.</q>",1090
69,"queen cup","queen-cell cup","<q>Empty cup-like beeswax structure where the queen may lay a fertile egg to start rearing another queen.</q>",32
70,"fungal disease",mycosis,"A disease caused by an organism belonging to the taxonomic kingdom Fungi.",106
71,"scattered brood","scattered brood pattern","<q>Departures from the compact and solid brood pattern generally associated with efficient brood production and populous colonies are frequently encountered in honey bees. Such a condition is referred to as scattered brood, shot brood, pepper brood,or spotty brood. [...] Scattered brood can result from non-pathogenic or pathogenic conditions or from a combination of these.</q>",1090
72,nectar,nectar,"<q>A sweet secretion of flowers (from nectaries) of various plants; some secrete enough to provide excess for conversion to honey.</q>",63
73,honeydew,honeydew,"<q>A sweet fluid excreted by plant-sucking insects like aphids, Bees occasionally collect and ripen it into a type of honey marketed as pine or forest honey.</q>",63
74,"nectar honey","nectar honey","Honey produced from nectar.",23
75,"honeydew honey","honeydew honey","Honey produced from honeydew.",23
76,"insect parasite on Apis mellifera","insect parasite on Apis mellifera","A parasite belonging to the taxonomic class Insecta whose host is the species Apis mellifera.",19;3270
77,"worker brood","worker brood","Brood consisting exlusively of eggs, larvae, pupae or non-hatches imagini of female workers.",24
78,"Galleria mellonella","greater wax moth","The taxonomic species <i>Galleria mellonella</i> ",76
79,"Aethina tumida","Small hive beetle","The taxonomic species <i>Aethina tumida</i> ",76
80,"Varroa destructor","Varroa mite","The taxonomic species *Varroa destructor*",3268;3269
81,"acarid parasite","acarid parasite","A parasite belonging to the taxonomic class Arachnida.",83
82,"animal parasite","animal parasite","A parasite belonging to the taxonomic kingdom Animalia.",66
83,"arthropod parasite","arthropod parasite","A parasite belonging to the taxonomic phylum Arthropoda.",82
84,"bacterial parasite","bacterial parasite","A parasite belonging to the taxonomic kingdom Bacteria.",66
85,"fungal parasite on Apis mellifera","fungal parasite on Apis mellifera","A parasite belonging to the taxonomic kingdom Fungi whose host is the species Apis mellifera.",19;3272
86,"protozoan parasite
","protozoan parasite ","A parasite belonging to the taxonomic kingdom Protozoa.",66
87,"Braula coeca","bee louse","The taxonomic species <i>Braula coeca</i> ",76
88,"Acarapis woodi","acarine mite","The taxonomic species <i>Acarapis woodi</i> ",3268
89,"Paenibacillus larvae","Paenibacillus larvae","The taxonomic species <i>Paenibacillus larvae</i> ",3271
90,"Melissococcus plutonius","Melissococcus plutonius","The taxonomic species <i>Melissococcus plutonius</i> ",3271
91,"Tropilaelaps spp.","Tropilaelaps spp.","The taxonomic genus <i>Tropilaelaps</i> ",3268
92,"Nosema apis","Nosema apis","The taxonomic species <i>Nosema apis</i> ",85
93,"Nosema ceranae","Nosema ceranae","The taxonomic species <i>Nosema ceranae</i> ",85
94,"Ascosphaera apis","Ascosphaera apis","The taxonomic species <i>Ascosphaera apis</i> ",85
95,"Aspergillus flavus","Aspergillus flavus","The taxonomic species <i>Aspergillus flavus</i> ",85
96,"Malpighamoeba mellificae","Malpighamoeba mellificae","<q>Amoebas infecting the Malpighian tubuiles of honey bees named [...] <i>Malpighamoeba</i> [...] <i>mellificae</i> [...].</q>",3273
97,pathogen,pathogen,"<q>An agent causing disease or illness to its host, such as an organism or infectious particle capable of producing a disease in another organism.</q>",125
98,virus,virus,"<q>A submicroscopic infectious agent that is unable to grow or reproduce outside a host cell. It is non-cellular but consisting of a core of DNA or RNA surrounded by a protein coat.</q>",97
99,"ABPV
","Acute Bee Paralysis Virus","Acute Bee Paralysis Virus",3274
100,"CBPV
","Chronic Bee Paralysis Virus","Chronic Bee Paralysis Virus",3274
101,"KBV
","Kashmir Bee Virus","Kashmir Bee Virus",3274
102,"IAPV
","Israeli Acute Paralysis Virus","Israeli Acute Paralysis Virus",3274
103,"BQCV
","Black Queen Cell Virus","Black Queen Cell Virus",3274
104,"DWV
","Deformed Wing Virus","> Deformed wing virus (DWV) is an RNA virus, one of 22 known viruses affecting honey bees. While most commonly infecting the honey bee, Apis mellifera, it has also been documented in other bee species, like Bombus terrestris,[...] thus, indicating it may have a wider host specificity than previously anticipated. The virus was first isolated from a sample of symptomatic honeybees from Japan in the early 1980s and is currently distributed worldwide. It is found also in pollen baskets and commercially reared bumblebees.[...] Its main vector in A. mellifera is the Varroa mite.[...] It is named after what is usually the most obvious deformity it induces in the development of a honeybee pupa, which is shrunken and deformed wings, but other developmental deformities are often present.",3274
105,"SBV
","sackbrood virus","Sackbrood Virus",3274
106,disease,disease,"‘disease’ means the occurrence of infections and infestations in animals, with or without clinical or pathological manifestations, caused by one or more disease agents;",125
107,"disease caused or transmitted by arthropods","disease caused or transmitted by arthropods","A disease caused or transmitted by an organism belonging to the taxonomic phylum Arthropoda.",106
108,"bacterial disease","bacterial disease","A disease caused or transmitted by an organism belonging to the taxonomic kingdom Bacteria.",106
109,"viral disease","viral disease","A disease caused or transmitted by a Virus.",106
110,"protozoan disease","protozoan disease","A disease caused or transmitted by an organism belonging to the taxonomic kingdom Protozoa.",106
111,"disease caused or transmitted by insects","disease caused or transmitted by insects","A disease caused or transmitted by an organism belonging to the taxonomic class Insecta.",107
112,"disease caused or transmitted by acari","disease caused or transmitted by acari","A disease caused or transmitted by an organism belonging to the taxonomic class Arachnida.",107
113,"Acarapisosis of honey bees","acarine disease;Isle of Wight disease","For the purposes of the Terrestrial Code, acarapisosis, also known as acarine disease or tracheal mite infestation, is an infestation of adult honey bees (species of the genus *Apis*), primarily *Apis mellifera* L. with the mite *Acarapis woodi*, an internal obligate parasite of the respiratory system which spreads by direct contact from adult honey bee to adult honey bee.",112;3341
114,"Varroosis of honey bees",varroosis,"> For the purposes of the Terrestrial Code, varroosis is a disease of honey bees (species of the genus *Apis*) caused by mites in the genus Varroa, primarily *Varroa destructor*. The mite is an ectoparasite of adults and brood of honey bees and spreads by direct contact from adult honey bee to adult honey bee, and by the movement of infested honey bees, bee brood, bee products and used apicultural equipment.",112;3341
115,"Tropilaelaps infestation of honey bees","Tropilaelaps infestation of honey bees","> For the purposes of the Terrestrial Code, *Tropilaelaps* infestation of honey bees (species of the genus *Apis*) is caused by different species of *Tropilaelaps* mites (including the mites *Tropilaelaps clareae*, *T. koenigerum*, *T. thaii* and *T. mercedesae*). The mite is an ectoparasite of brood of honey bees, and cannot survive for periods of more than 21 days away from bee brood.",112;3341
116,"Small hive beetle infestation (Aethina tumida)","Small hive beetle (Aethina tumida) infestation","> For the purposes of the Terrestrial Code, infestation with *Aethina tumida* (also known as small hive beetle) is an infestation of bee colonies (species of the genera *Apis* and *Bombus* and also stingless bees) by the beetle *A. tumida*, which is a free-living predator and scavenger affecting bee populations.",111;3341
117,"American foulbrood of honey bees (AFB)","american foulbrood","> For the purposes of the Terrestrial Code, American foulbrood is a disease of the larval and pupal stages of honey bees (species of the genus *Apis*) caused by *[Paenibacillus larvae](https://app.pollinatorhub.eu/vocabulary/classes/89)* (*P. larvae*), which is widely distributed. *P. larvae* is a bacterium that can produce over one billion spores in each infected larva. The spores are very long-living and extremely resistant to heat and chemical agents, and only the spores are capable of inducing the disease.",108;3341
118,"European foulbrood of honey bees (EFB)","European foulbrood","> For the purposes of the Terrestrial Code, European foulbrood is a disease of the larval and pupal stages of honey bees (species of the genus *Apis*), caused by *[Melissococcus plutonius](https://app.pollinatorhub.eu/vocabulary/classes/90)* (*M. plutonius*), a non-sporulating bacterium, which is widely distributed. Subclinical infections are common and require laboratory diagnosis. Infection remains enzootic because of mechanical contamination of the honeycombs. Recurrences of disease can therefore be expected in subsequent years.",108;3341
119,"Sacbrood disease of honey bees","sac brood;pickled brood","A disease of the larval stages of honey bees (*Apis mellifera*) caused by the Sacbrood Virus (SBV).",109;3341
120,"Chronic bee paralysis disease of honey bees","Chronic bee paralysis disease of honey bees","A disease of adult honey bees (*Apis mellifera*) caused by the Chronic Bee Paralysis Virus (CBPV).",109;3341
121,"Chalkbrood disease of honey bees","chalk brood","A disease of the larval and pupal stages of honey bees (*Apis mellifera*) caused by the fungus *Ascosphaera apis*.",70;3341
122,"Stonebrood disease of honey bees",stonebrood,"A disease of the larval and pupal stages of honey bees (*Apis mellifera*) caused by the fungus *Aspergillus flavus*.",70;3341
123,"Nosemosis of honey bees","Nosema disease","A disease of adult [honey bees](https://app.pollinatorhub.eu/vocabulary/classes/19) (*Apis mellifera*) caused by different species of the genus *Nosema* (*[Nosema apis](https://app.pollinatorhub.eu/vocabulary/classes/92)* and *[Nosema ceranae](https://app.pollinatorhub.eu/vocabulary/classes/93)*).",70;3341
124,"amoeba disease of honey bees","amoeba disease","A disease of adult [honey bees](https://app.pollinatorhub.eu/vocabulary/classes/19) (*Apis mellifera*) caused by *[Malpighamoeba mellificae](https://app.pollinatorhub.eu/vocabulary/classes/96)*.",110;3341
125,"veterinary medicine","veterinary medicine","> The branch of medicine dealing with the prevention and treatment of diseases and injuriess in animals, esp. domestic animals",3359
126,beekeeping,beekeeping,"The intentional tending of insects of the genus *Apis* (in particular *Apis mellifera* and *Apis cerana*) in artificial nests by humans (*Homo sapiens*).",3266
127,attribute,attribute,"An expression used to define other expressions in more detail.",7751
128,Apis,Apis,"The taxonomic genus <i>Apis</i> Linnaeus, 1758",2961
129,Country,country,"A term from the [Darwin Core standard](https://dwc.tdwg.org/list/#dc_type):

> The name of the country or major administrative unit in which the [dcterms:Location](https://app.pollinatorhub.eu/vocabulary/classes/7367) occurs. ",960;7367
130,Antarctica,Antarctica,"Antarctica (ISO 3166 alpha-3 country code ATA)",129
131,Bulgaria,Bulgaria,"The Republic of Bulgaria (ISO 3166 alpha-3 country code BGR)",129
132,Myanmar,Myanmar,"The Republic of The Union of Myanmar (ISO 3166 alpha-3 country code MMR)",129
133,Burundi,Burundi,"The Republic of Burundi (ISO 3166 alpha-3 country code BDI)",129
134,Belarus,Belarus,"The Republic of Belarus (ISO 3166 alpha-3 country code BLR)",129
135,Cambodia,Cambodia,"The Kingdom of Cambodia (ISO 3166 alpha-3 country code KHM)",129
136,Algeria,Algeria,"The People's Democratic Republic of Algeria (ISO 3166 alpha-3 country code DZA)",129
137,Cameroon,Cameroon,"The Republic of Cameroon (ISO 3166 alpha-3 country code CMR)",129
138,Canada,Canada,"The country Canada (ISO 3166 alpha-3 country code CAN)",129
139,"Cabo Verde","Cabo Verde","The Republic of Cabo Verde (ISO 3166 alpha-3 country code CPV)",129
140,"Cayman Islands (the)","Cayman Islands","The Cayman Islands (ISO 3166 alpha-3 country code CYM)",129
141,"Central African Republic (the)","Central African Republic","The Central African Republic (ISO 3166 alpha-3 country code CAF)",129
142,"Sri Lanka","Sri Lanka","The Democratic Socialist Republic of Sri Lanka (ISO 3166 alpha-3 country code LKA)",129
143,Chad,Chad,"The Republic of Chad (ISO 3166 alpha-3 country code TCD)",129
144,Chile,Chile,"The Republic of Chile (ISO 3166 alpha-3 country code CHL)",129
145,China,China,"The People's Republic of China (ISO 3166 alpha-3 country code CHN)",129
146,"Taiwan (Province of China)",Taiwan,"The country Taiwan (ISO 3166 alpha-3 country code TWN)",129
147,"American Samoa","American Samoa","The country American Samoa (ISO 3166 alpha-3 country code ASM)",129
148,"Christmas Island","Christmas Island","The Christmas Island (ISO 3166 alpha-3 country code CXR)",129
149,"Cocos (Keeling) Islands (the)","Cocos Islands;Keeling Islands","The Cocos (Keeling) Islands (ISO 3166 alpha-3 country code CCK)",129
150,Colombia,Colombia,"The Republic of Colombia (ISO 3166 alpha-3 country code COL)",129
151,"Comoros (the)",Comoros,"The Union of The Comoros (ISO 3166 alpha-3 country code COM)",129
152,Mayotte,Mayotte,"The country Mayotte (ISO 3166 alpha-3 country code MYT)",129
153,"Congo (the)",Congo,"The Republic of The Congo (ISO 3166 alpha-3 country code COG)",129
154,"Congo (the Democratic Republic of the)",Congo,"The Democratic Republic of The Congo (ISO 3166 alpha-3 country code COD)",129
155,Afghanistan,Afghanistan,"The Islamic Republic of Afghanistan (ISO 3166 alpha-3 country code AFG)",129
156,"Åland Islands","Åland Islands","th Åland Islands (ISO 3166 alpha-3 country code ALA)",129
